{
  "id": "workspace-inventory-nested-python-service",
  "skill": "workspace-inventory",
  "bucket": "realistic",
  "difficulty": "medium",
  "arms": ["xs_without_skill", "xs_with_skill", "m_without_skill", "m_with_skill"],
  "publishability": "internal",
  "validator": {
    "command": ["bun", "skills/workspace-inventory/scripts/validate_workspace_inventory.ts"],
    "expected_status": "pass"
  },
  "notes": "Realistic case: a small Python service workspace with two top-level config/README files (pyproject.toml, README.md) and four subdirectories (src, tests, docs, scripts) each containing at least one file, including nested files under src/app/. The gold inventory exercises lexicographic ordering across mixed case (\"README.md\" sorts before \"docs\" by ASCII codepoint), recursive counts (src has 3 files inside src/app/), and total_files=9. Synthetic fixture; no customer data."
}
