{
  "id": "ce-plan-quality-mcp-apps-ui-rendering",
  "skill": "ce-plan",
  "bucket": "realistic",
  "difficulty": "medium",
  "arms": [
    "xs_with_skill"
  ],
  "publishability": "internal",
  "validator": {
    "command": [
      "bun",
      "skills/ce-plan/scripts/validate_ce_plan_quality.ts"
    ],
    "expected_status": "pass"
  },
  "notes": "GEPA-calibrated ce-plan quality case derived from poolside-studio docs/plans/mcp-apps-ui-rendering.md. Generated fixture; no customer data."
}
