{
  "id": "bead-selector-missing-required-label",
  "skill": "bead-selector",
  "bucket": "edge",
  "difficulty": "medium",
  "arms": [
    "xs_without_skill",
    "xs_with_skill",
    "m_without_skill",
    "m_with_skill"
  ],
  "publishability": "internal",
  "validator": {
    "command": [
      "bun",
      "skills/bead-selector/scripts/validate_bead_selection.ts"
    ],
    "expected_status": "pass"
  },
  "notes": "Synthetic fixture testing label-focused selection when the requested label has no matching Beads. Generated case."
}
