{
  "id": "bead-selector-no-unblocked-ready-beads",
  "skill": "bead-selector",
  "bucket": "edge",
  "difficulty": "medium",
  "arms": [
    "xs_without_skill",
    "xs_with_skill",
    "m_without_skill",
    "m_with_skill"
  ],
  "publishability": "internal",
  "validator": {
    "command": [
      "bun",
      "skills/bead-selector/scripts/validate_bead_selection.ts"
    ],
    "expected_status": "pass"
  },
  "notes": "All Beads are blocked or not ready. The agent must select 'none' after confirming via robot triage. Synthetic fixture; no customer data. Generated case."
}
